[
  {
    "transaction_id": "NORM-100001",
    "timestamp": "2026-10-23T10:00:00Z",
    "source_account": "ACC-1082",
    "destination_account": "ACC-1097",
    "amount": 465.02,
    "currency": "INR",
    "device_id": "DEV-1082",
    "ip_address": "203.0.113.83",
    "status": "completed"
  },
  {
    "transaction_id": "NORM-100002",
    "timestamp": "2026-10-23T10:00:26Z",
    "source_account": "ACC-1087",
    "destination_account": "ACC-1062",
    "amount": 1852.16,
    "currency": "INR",
    "device_id": "DEV-1087",
    "ip_address": "203.0.113.88",
    "status": "completed"
  },
  {
    "transaction_id": "NORM-100003",
    "timestamp": "2026-10-23T10:00:47Z",
    "source_account": "ACC-1012",
    "destination_account": "ACC-1040",
    "amount": 661.21,
    "currency": "INR",
    "device_id": "DEV-1012",
    "ip_address": "203.0.113.13",
    "status": "completed"
  },
  {
    "transaction_id": "NORM-100004",
    "timestamp": "2026-10-23T10:01:41Z",
    "source_account": "ACC-1054",
    "destination_account": "ACC-1083",
    "amount": 466.91,
    "currency": "INR",
    "device_id": "DEV-1054",
    "ip_address": "203.0.113.55",
    "status": "completed"
  },
  {
    "transaction_id": "NORM-100005",
    "timestamp": "2026-10-23T10:02:11Z",
    "source_account": "ACC-1090",
    "destination_account": "ACC-1025",
    "amount": 393.29,
    "currency": "INR",
    "device_id": "DEV-1090",
    "ip_address": "203.0.113.91",
    "status": "completed"
  },
  {
    "transaction_id": "NORM-100006",
    "timestamp": "2026-10-23T10:02:52Z",
    "source_account": "ACC-1014",
    "destination_account": "ACC-1026",
    "amount": 515.39,
    "currency": "INR",
    "device_id": "DEV-1014",
    "ip_address": "203.0.113.15",
    "status": "completed"
  },
  {
    "transaction_id": "NORM-100007",
    "timestamp": "2026-10-23T10:03:28Z",
    "source_account": "ACC-1104",
    "destination_account": "ACC-1110",
    "amount": 1382.61,
    "currency": "INR",
    "device_id": "DEV-1104",
    "ip_address": "203.0.113.105",
    "status": "completed"
  },
  {
    "transaction_id": "NORM-100008",
    "timestamp": "2026-10-23T10:04:12Z",
    "source_account": "ACC-1011",
    "destination_account": "ACC-1082",
    "amount": 677.18,
    "currency": "INR",
    "device_id": "DEV-1011",
    "ip_address": "203.0.113.12",
    "status": "completed"
  },
  {
    "transaction_id": "NORM-100009",
    "timestamp": "2026-10-23T10:04:55Z",
    "source_account": "ACC-1074",
    "destination_account": "ACC-1099",
    "amount": 941.24,
    "currency": "INR",
    "device_id": "DEV-1074",
    "ip_address": "203.0.113.75",
    "status": "completed"
  },
  {
    "transaction_id": "NORM-100010",
    "timestamp": "2026-10-23T10:05:33Z",
    "source_account": "ACC-1030",
    "destination_account": "ACC-1021",
    "amount": 466.78,
    "currency": "INR",
    "device_id": "DEV-1030",
    "ip_address": "203.0.113.31",
    "status": "completed"
  },
  {
    "transaction_id": "NORM-100011",
    "timestamp": "2026-10-23T10:06:16Z",
    "source_account": "ACC-1046",
    "destination_account": "ACC-1073",
    "amount": 1531.64,
    "currency": "INR",
    "device_id": "DEV-1046",
    "ip_address": "203.0.113.47",
    "status": "completed"
  },
  {
    "transaction_id": "NORM-100012",
    "timestamp": "2026-10-23T10:06:40Z",
    "source_account": "ACC-1078",
    "destination_account": "ACC-1040",
    "amount": 737.48,
    "currency": "INR",
    "device_id": "DEV-1078",
    "ip_address": "203.0.113.79",
    "status": "completed"
  },
  {
    "transaction_id": "NORM-100013",
    "timestamp": "2026-10-23T10:07:24Z",
    "source_account": "ACC-1035",
    "destination_account": "ACC-1034",
    "amount": 1401.25,
    "currency": "INR",
    "device_id": "DEV-1035",
    "ip_address": "203.0.113.36",
    "status": "completed"
  },
  {
    "transaction_id": "NORM-100014",
    "timestamp": "2026-10-23T10:07:47Z",
    "source_account": "ACC-1030",
    "destination_account": "ACC-1016",
    "amount": 489.27,
    "currency": "INR",
    "device_id": "DEV-1030",
    "ip_address": "203.0.113.31",
    "status": "completed"
  },
  {
    "transaction_id": "NORM-100015",
    "timestamp": "2026-10-23T10:08:20Z",
    "source_account": "ACC-1117",
    "destination_account": "ACC-1070",
    "amount": 1988.81,
    "currency": "INR",
    "device_id": "DEV-1117",
    "ip_address": "203.0.113.118",
    "status": "completed"
  },
  {
    "transaction_id": "NORM-100016",
    "timestamp": "2026-10-23T10:09:05Z",
    "source_account": "ACC-1114",
    "destination_account": "ACC-1112",
    "amount": 1028.58,
    "currency": "INR",
    "device_id": "DEV-1114",
    "ip_address": "203.0.113.115",
    "status": "completed"
  },
  {
    "transaction_id": "NORM-100017",
    "timestamp": "2026-10-23T10:10:00Z",
    "source_account": "ACC-1069",
    "destination_account": "ACC-1103",
    "amount": 1285.59,
    "currency": "INR",
    "device_id": "DEV-1069",
    "ip_address": "203.0.113.70",
    "status": "completed"
  },
  {
    "transaction_id": "NORM-100018",
    "timestamp": "2026-10-23T10:10:43Z",
    "source_account": "ACC-1029",
    "destination_account": "ACC-1047",
    "amount": 981.82,
    "currency": "INR",
    "device_id": "DEV-1029",
    "ip_address": "203.0.113.30",
    "status": "completed"
  },
  {
    "transaction_id": "NORM-100019",
    "timestamp": "2026-10-23T10:11:10Z",
    "source_account": "ACC-1020",
    "destination_account": "ACC-1101",
    "amount": 708.29,
    "currency": "INR",
    "device_id": "DEV-1020",
    "ip_address": "203.0.113.21",
    "status": "completed"
  },
  {
    "transaction_id": "NORM-100020",
    "timestamp": "2026-10-23T10:11:54Z",
    "source_account": "ACC-1049",
    "destination_account": "ACC-1006",
    "amount": 2117.47,
    "currency": "INR",
    "device_id": "DEV-1049",
    "ip_address": "203.0.113.50",
    "status": "completed"
  }
]
