[
  {
    "transaction_id": "TX-1001",
    "timestamp": "2026-08-17T15:30:00Z",
    "source_account": "ACC-101",
    "destination_account": "ACC-202",
    "amount": 85000,
    "currency": "INR",
    "device_id": "DEV-99",
    "ip_address": "185.220.101.10",
    "status": "pending"
  },
  {
    "transaction_id": "TX-1002",
    "timestamp": "2026-08-17T15:30:40Z",
    "source_account": "ACC-202",
    "destination_account": "ACC-303",
    "amount": 82500,
    "currency": "INR",
    "device_id": "DEV-202",
    "ip_address": "198.51.100.22",
    "status": "completed"
  },
  {
    "transaction_id": "TX-1003",
    "timestamp": "2026-08-17T15:31:10Z",
    "source_account": "ACC-303",
    "destination_account": "ACC-404",
    "amount": 80000,
    "currency": "INR",
    "device_id": "DEV-303",
    "ip_address": "198.51.100.33",
    "status": "completed"
  }
]
